{
  "id": "EPIC-016-F",
  "epicId": "EPIC-016",
  "phaseId": "PHASE-001",
  "title": "claude-mem 搜索策略:1 次 search 拿完 ID,1 次 get_observations 拉完",
  "type": "chore",
  "priority": "P2",
  "status": "done",
  "created_by": "master_main",
  "created_at": "2026-06-06T04:45:00Z",
  "file_scope": {
    "includes": [
      "~/.claude/skills/kallax/skills/kallax-init.md"
    ],
    "excludes": []
  },
  "dependencies": [],
  "acceptance_criteria": [
    "kallax-init.md 文档化 3-layer workflow(search → timeline → get_observations)",
    "明确:init 流程不主动调 claude-mem(只在用户显式要求历史时调)",
    "预期:claude-mem 调用次数从 ~5 降到 0(默认),最多 1 次(用户请求历史时)"
  ],
  "estimated_hours": 0.3
}
