{
  "id": "EPIC-016-C",
  "epicId": "EPIC-016",
  "phaseId": "PHASE-001",
  "title": "删除 init 流程中对项目根目录的 ls -la 全量扫描",
  "type": "refactor",
  "priority": "P1",
  "status": "done",
  "created_by": "master_main",
  "created_at": "2026-06-06T04:45:00Z",
  "file_scope": {
    "includes": [
      "~/.claude/skills/kallax/skills/kallax-init.md"
    ],
    "excludes": []
  },
  "dependencies": ["EPIC-016-B"],
  "acceptance_criteria": [
    "kallax-init.md 中删除任何「ls -la 项目根」「find . -type d」类指令",
    "如果必须查 .kallax/ 状态,改为单条 `test -d .kallax && echo exists || echo missing`",
    "my_projects(9GB+ 30+ 子项目)下,init 流程不再触发超过 1 个目录列取命令",
    "benchmark 验证:bash_calls 字段从 ~6 降到 ≤2"
  ],
  "estimated_hours": 0.3
}
